   0x00000000 0x00: eax=0x0000000d ebx=0x756e6547 ecx=0x6c65746e edx=0x49656e69
   0x00000001 0x00: eax=0x000306c3 ebx=0x03020800 ecx=0xfffa3223 edx=0x1f8bfbff
   0x00000002 0x00: eax=0x76036301 ebx=0x00f0b5ff ecx=0x00000000 edx=0x00c10000
   0x00000003 0x00: eax=0x00000000 ebx=0x00000000 ecx=0x00000000 edx=0x00000000
   0x00000004 0x00: eax=0x04000121 ebx=0x01c0003f ecx=0x0000003f edx=0x00000000
   0x00000004 0x01: eax=0x04000122 ebx=0x01c0003f ecx=0x0000003f edx=0x00000000
   0x00000004 0x02: eax=0x04000143 ebx=0x01c0003f ecx=0x000001ff edx=0x00000000
   0x00000004 0x03: eax=0x04004163 ebx=0x03c0003f ecx=0x00001fff edx=0x00000006
   0x00000005 0x00: eax=0x00000000 ebx=0x00000000 ecx=0x00000000 edx=0x00000000
   0x00000006 0x00: eax=0x00000004 ebx=0x00000000 ecx=0x00000000 edx=0x00000000
   0x00000007 0x00: eax=0x00000000 ebx=0x000027ab ecx=0x00000000 edx=0xbc000400
   0x00000008 0x00: eax=0x00000000 ebx=0x00000000 ecx=0x00000000 edx=0x00000000
   0x00000009 0x00: eax=0x00000000 ebx=0x00000000 ecx=0x00000000 edx=0x00000000
   0x0000000a 0x00: eax=0x07300403 ebx=0x00000000 ecx=0x00000000 edx=0x00000603
   0x0000000b 0x00: eax=0x00000000 ebx=0x00000001 ecx=0x00000100 edx=0x00000003
   0x0000000b 0x01: eax=0x00000001 ebx=0x00000002 ecx=0x00000201 edx=0x00000003
   0x0000000c 0x00: eax=0x00000000 ebx=0x00000000 ecx=0x00000000 edx=0x00000000
   0x0000000d 0x00: eax=0x00000007 ebx=0x00000340 ecx=0x00000340 edx=0x00000000
   0x0000000d 0x01: eax=0x00000001 ebx=0x00000000 ecx=0x00000000 edx=0x00000000
   0x0000000d 0x02: eax=0x00000100 ebx=0x00000240 ecx=0x00000000 edx=0x00000000
   0x40000000 0x00: eax=0x40000010 ebx=0x61774d56 ecx=0x4d566572 edx=0x65726177
   0x40000001 0x00: eax=0x00000000 ebx=0x00000000 ecx=0x00000000 edx=0x00000000
   0x40000002 0x00: eax=0x00000000 ebx=0x00000000 ecx=0x00000000 edx=0x00000000
   0x40000003 0x00: eax=0x00000000 ebx=0x00000000 ecx=0x00000000 edx=0x00000000
   0x40000004 0x00: eax=0x00000000 ebx=0x00000000 ecx=0x00000000 edx=0x00000000
   0x40000005 0x00: eax=0x00000000 ebx=0x00000000 ecx=0x00000000 edx=0x00000000
   0x40000006 0x00: eax=0x00000000 ebx=0x00000000 ecx=0x00000000 edx=0x00000000
   0x40000007 0x00: eax=0x00000000 ebx=0x00000000 ecx=0x00000000 edx=0x00000000
   0x40000008 0x00: eax=0x00000000 ebx=0x00000000 ecx=0x00000000 edx=0x00000000
   0x40000009 0x00: eax=0x00000000 ebx=0x00000000 ecx=0x00000000 edx=0x00000000
   0x4000000a 0x00: eax=0x00000000 ebx=0x00000000 ecx=0x00000000 edx=0x00000000
   0x4000000b 0x00: eax=0x00000000 ebx=0x00000000 ecx=0x00000000 edx=0x00000000
   0x4000000c 0x00: eax=0x00000000 ebx=0x00000000 ecx=0x00000000 edx=0x00000000
   0x4000000d 0x00: eax=0x00000000 ebx=0x00000000 ecx=0x00000000 edx=0x00000000
   0x4000000e 0x00: eax=0x00000000 ebx=0x00000000 ecx=0x00000000 edx=0x00000000
   0x4000000f 0x00: eax=0x00000000 ebx=0x00000000 ecx=0x00000000 edx=0x00000000
   0x40000010 0x00: eax=0x0035484a ebx=0x000101d0 ecx=0x00000000 edx=0x00000000
   0x80000000 0x00: eax=0x80000008 ebx=0x00000000 ecx=0x00000000 edx=0x00000000
   0x80000001 0x00: eax=0x00000000 ebx=0x00000000 ecx=0x00000021 edx=0x2c100800
   0x80000002 0x00: eax=0x65746e49 ebx=0x2952286c ecx=0x6f655820 edx=0x2952286e
   0x80000003 0x00: eax=0x55504320 ebx=0x2d334520 ecx=0x30373231 edx=0x20337620
   0x80000004 0x00: eax=0x2e332040 ebx=0x48473035 ecx=0x0000007a edx=0x00000000
   0x80000005 0x00: eax=0x00000000 ebx=0x00000000 ecx=0x00000000 edx=0x00000000
   0x80000006 0x00: eax=0x00000000 ebx=0x00000000 ecx=0x01006040 edx=0x00000000
   0x80000007 0x00: eax=0x00000000 ebx=0x00000000 ecx=0x00000000 edx=0x00000100
   0x80000008 0x00: eax=0x0000302b ebx=0x00000000 ecx=0x00000000 edx=0x00000000
   0x80860000 0x00: eax=0x00000007 ebx=0x00000340 ecx=0x00000340 edx=0x00000000
   0xc0000000 0x00: eax=0x00000007 ebx=0x00000340 ecx=0x00000340 edx=0x00000000
